{
  "schema_version": "raw_slot.v1",
  "slot": "recipe_description.video_b",
  "comparison_id": "6b4cf129dfb0bd3a",
  "run_id": "ccd04925-4674-4190-a51a-61598cf52e2f",
  "generated_at": "2026-05-04T07:10:07.791986+00:00",
  "model": {
    "model_id": "meta-llama/Llama-3.2-3B-Instruct",
    "model_revision": "meta-llama/Llama-3.2-3B-Instruct",
    "seed": 3075626710,
    "do_sample": false,
    "temperature": 0.4,
    "top_p": 0.9,
    "max_new_tokens": 100
  },
  "asset_hashes": {
    "voice_exemplars_hash": "1f0417fa2af2",
    "recipe_library_version": "1.0",
    "chord_library_version": "1.0"
  },
  "prompt_rendered": "You are writing the description paragraph for one video's recipe in a Brain Diff\nstrategy insight panel.\n\nBrain Diff is a STRATEGY comparison. The description's job: take the matched\nrecipe's general template and customize it with this specific video's actual\ncortical events. The result must feel like it was written about THIS video,\nnot the recipe in general.\n\nFormat: 2 sentences max, ≤ 35 words total. The first sentence describes what\nthe cortex did across the runtime. The second sentence is the \"Built for X\"\ntag-line. The \"Built for X\" suffix MUST be wrapped in single asterisks like\n*Built for retention.* — this gets rendered as italic.\n\nThe description MUST contain at least one timestamp from the input data\n(format M:SS, e.g. 0:32).\n\nNo anatomical jargon. No percentages. No citations. No winner/loser framing.\n\nInputs:\n- Matched recipe: Visceral Hook → Low-Effort Hold\n- Recipe description template: Immediate anterior insula spike in the opening seconds, sustained low cognitive effort across the middle, late Emotional Impact in the closing third.\n- Built for tag: spread\n- Video's chord moments with timestamps:\n  - visceral-hit at 0:08 (\"I'll give one million dollars to the last person standing....\")\n  - emotional-impact at 0:47 (\"You can change your life right now. This is your shot....\")\n- Video's top 2 dimension peaks:\n  - attention peak at 0:03 (value 0.78)\n  - gut_reaction peak at 0:03 (value 0.78)\n- Video subject: MrBeast\n\nVoice exemplars:\n  1. Gradual attention, deep language and memory engagement, climax in a Reasoning Beat at 0:32. *Built for retention.*\n  2. Immediate anterior insula spike, sustained low cognitive effort, late Emotional Impact at 0:47. *Built for spread.*\n  3. Personal resonance opens at 0:04, theory-of-mind takes over at 0:18, narrative integration sustains through close. *Built for parasocial bond.*\n  4. Visceral hit at 0:09, reasoning beat at 0:22, second visceral peak at 0:48. The classic three-act feel-think-feel arc. *Built for persuasion.*\n  5. Visceral hit at 0:09, sustained low effort through the middle, emotional close at 0:54. The pattern that defined a decade of YouTube. *Built for shareability.*\n\nGenerate 2 candidate descriptions in this voice. Select the one that uses the\nmost specific timestamp evidence. Output only the selected description.\nNo explanation.\n",
  "candidates": [
    "*Built for spread.*\n\nAt 0:08, MrBeast's visceral hit sparks a wave of emotional investment, which peaks at 0:47 with a powerful call-to-action, leaving a lasting impact on viewers."
  ],
  "selected": "*Built for spread.*\n\nAt 0:08, MrBeast's visceral hit sparks a wave of emotional investment, which peaks at 0:47 with a powerful call-to-action, leaving a lasting impact on viewers.",
  "attempts": 1,
  "validation": {
    "passed": true,
    "errors": []
  },
  "latency_ms": 44554
}