{
  "schema_version": "raw_slot.v1",
  "slot": "chord_moments[2].context",
  "comparison_id": "6b4cf129dfb0bd3a",
  "run_id": "a64ebee4-e2e1-4660-b5e5-e3e0be4c02c9",
  "generated_at": "2026-05-04T03:42:02.810797+00:00",
  "model": {
    "model_id": "stub-llama-3.2-3b-instruct",
    "model_revision": "stub-v0",
    "seed": 1583694699,
    "do_sample": false,
    "temperature": 0.4,
    "top_p": 0.9,
    "max_new_tokens": 80
  },
  "asset_hashes": {
    "voice_exemplars_hash": "0d3b1a744d6d",
    "recipe_library_version": "1.0",
    "chord_library_version": "1.0"
  },
  "prompt_rendered": "You are writing one personalized sentence to append to a chord's general\nmeaning in the Brain Diff results page.\n\nThe chord type's meaning is already explained generically above your sentence.\nYour job: add ONE sentence that grounds this specific firing in this specific\nvideo. Reference the quote, the timestamp, the creator name, or a specific\ncortical detail.\n\nFormat: 1 sentence, ≤ 22 words. Direct, specific, no hedge language.\nNo anatomical jargon. No percentages. No citations. No winner/loser framing.\n\nInputs:\n- Chord type: Visceral Hit\n- Chord general meaning (already on page, do not repeat): The body reacts before the mind catches up. The anterior insula — the cortex's interoceptive hub, mapping body-state signals into felt sensation — fires high while the dorsolateral prefrontal cortex s\n- Firing timestamp (M:SS): 0:08\n- Firing video subject: MrBeast\n- Quote at this moment: I'll give one million dollars...\n- Specific values that triggered the chord: (not provided)\n\nVoice exemplars (this slot's anchors):\n  - The viewer's body responds to the offer before they've decided whether they care.\n  - The viewer's body responds to the threat before they've decided whether to flinch.\n  - MrBeast's hook lands in the chest before the prefrontal cortex has time to evaluate it.\n\nGenerate 2 candidate sentences. Select the one with the most specific grounding.\nOutput only the selected sentence as a single string. No explanation.\n",
  "candidates": [
    "The viewer's body responds at 0:08 before deciding whether to care."
  ],
  "selected": "The viewer's body responds at 0:08 before deciding whether to care.",
  "attempts": 1,
  "validation": {
    "passed": true,
    "errors": []
  },
  "latency_ms": 51
}