{
  "schema_version": "raw_slot.v1",
  "slot": "chord_moments[3].context",
  "comparison_id": "6b4cf129dfb0bd3a",
  "run_id": "cd49c08e-9723-4917-a027-da9cd13139ef",
  "generated_at": "2026-05-04T04:24:42.968795+00:00",
  "model": {
    "model_id": "stub-llama-3.2-3b-instruct",
    "model_revision": "stub-v0",
    "seed": 350424303,
    "do_sample": false,
    "temperature": 0.4,
    "top_p": 0.9,
    "max_new_tokens": 80
  },
  "asset_hashes": {
    "voice_exemplars_hash": "1f0417fa2af2",
    "recipe_library_version": "1.0",
    "chord_library_version": "1.0"
  },
  "prompt_rendered": "You are writing one personalized sentence to append to a chord's general\nmeaning in the Brain Diff results page.\n\nThe chord type's meaning is already explained generically above your sentence.\nYour job: add ONE sentence that grounds this specific firing in this specific\nvideo. Reference the quote, the timestamp, the creator name, or a specific\ncortical detail.\n\nFormat: 1 sentence, ≤ 22 words. Direct, specific, no hedge language.\nNo anatomical jargon. No percentages. No citations. No winner/loser framing.\n\nInputs:\n- Chord type: Emotional Impact\n- Chord general meaning (already on page, do not repeat): The medial prefrontal cortex (mPFC) and the anterior insula co-activate — self-relevance and visceral response firing simultaneously. The cortex is saying \"this matters to me, in my body.\" This is the\n- Firing timestamp (M:SS): 0:47\n- Firing video subject: MrBeast\n- Quote at this moment: You can change your life right now. This is your shot.\n- Specific values that triggered the chord: (not provided)\n\nVoice exemplars (this slot's anchors):\n  - The promise is personal AND felt — the cortical pattern that drives behavior change.\n  - Self-relevance and visceral response fire together — the moment the content stops being information and becomes meaning.\n  - The cortex is saying 'this matters to me, in my body' — the signature of content that doesn't just inform but lands.\n\nGenerate 2 candidate sentences. Select the one with the most specific grounding.\nOutput only the selected sentence as a single string. No explanation.\n",
  "candidates": [
    "The viewer's body responds at 0:47 before deciding whether to care."
  ],
  "selected": "The viewer's body responds at 0:47 before deciding whether to care.",
  "attempts": 1,
  "validation": {
    "passed": true,
    "errors": []
  },
  "latency_ms": 53
}