{
  "schema_version": "raw_slot.v1",
  "slot": "chord_moments[1].meaning",
  "comparison_id": "6b4cf129dfb0bd3a",
  "run_id": "181631f8-5fe6-452d-b2b3-778a00d7a8f4",
  "generated_at": "2026-05-04T05:47:24.939291+00:00",
  "model": {
    "model_id": "stub-llama-3.2-3b-instruct",
    "model_revision": "stub-v0",
    "seed": 4288723076,
    "do_sample": false,
    "temperature": 0.4,
    "top_p": 0.9,
    "max_new_tokens": 220
  },
  "asset_hashes": {
    "voice_exemplars_hash": "1f0417fa2af2",
    "recipe_library_version": "1.0",
    "chord_library_version": "1.0"
  },
  "prompt_rendered": "You are rewriting the meaning of a chord — but for THIS specific firing in\nTHIS specific video, not the generic textbook explanation.\n\nThe chord type's generic meaning is provided as reference. Your job: write a\nCONTEXTUALISED meaning that explains why this chord fired here — using the\nquote at this moment, the timestamp, the systems that crossed threshold, and\nthe video's title. The result should READ like a normal explanation of the\nchord, but be specific to this firing instead of generic.\n\nThis REPLACES the generic meaning on the page — the user only sees yours.\nSo it must (a) explain the chord type's mechanism in plain language, AND (b)\nground that explanation in this video's specific moment.\n\nFormat: 2-3 sentences, ≤ 70 words. Direct, specific, plain English. May use\nthe chord type's anatomical anchors sparingly if it helps explain (e.g.\n\"anterior insula\"), but DO NOT include percentages, r-values, citations, or\nyear stamps. No winner/loser framing. Use the video TITLE, not creator names.\n\nInputs:\n- Chord type: Reasoning Beat\n- Generic meaning (reference only — rewrite, don't quote): The viewer is actively interpreting. The dorsolateral prefrontal cortex applies cognitive control while the language network — Broca's and Wernicke's together — processes semantic meaning under that control. This isn't passive listening; the cortex is restructuring its mental model in real time. The signature of content that asks the viewer to think rather than feel.\n- Firing timestamp (M:SS): 0:32\n- Video title: Cleo Abram\n- Quote at this moment: Quantum computing isn't about being faster. It's about doing things classical computers literally cannot do.\n- Specific cortical values that triggered the chord: (not provided)\n- The systems that crossed threshold for this chord: brain_effort, language_depth\n\nVoice exemplars for this chord type (anchors):\n  - Cleo restructures the viewer's mental model in real time — the cortex has to work to follow.\n  - Cleo restructures what the viewer thought they knew about quantum computing in 4.2 seconds.\n  - The argument requires effort because it contradicts a default mental model — and the cortex shows up for the work.\n\nGenerate 2 candidate contextualised meanings. Select the one that most\nspecifically grounds the explanation in this firing. Output only the selected\nmeaning. No explanation, no quotes around the output.\n",
  "candidates": [
    "At 0:32 in Cleo Abram, the body reacts before the mind catches up. The systems involved cross threshold together while cognitive control stays quiet — a moment that lands in the chest before the brain has decided whether to care."
  ],
  "selected": "At 0:32 in Cleo Abram, the body reacts before the mind catches up. The systems involved cross threshold together while cognitive control stays quiet — a moment that lands in the chest before the brain has decided whether to care.",
  "attempts": 1,
  "validation": {
    "passed": true,
    "errors": []
  },
  "latency_ms": 45
}