{
  "schema_version": "raw_slot.v1",
  "slot": "chord_moments[1].context",
  "comparison_id": "f8e6953993dda569",
  "run_id": "af31f6d6-9f7e-4a73-a3db-5b30c1dac80c",
  "generated_at": "2026-05-04T03:42:02.902651+00:00",
  "model": {
    "model_id": "stub-llama-3.2-3b-instruct",
    "model_revision": "stub-v0",
    "seed": 708196588,
    "do_sample": false,
    "temperature": 0.4,
    "top_p": 0.9,
    "max_new_tokens": 80
  },
  "asset_hashes": {
    "voice_exemplars_hash": "0d3b1a744d6d",
    "recipe_library_version": "1.0",
    "chord_library_version": "1.0"
  },
  "prompt_rendered": "You are writing one personalized sentence to append to a chord's general\nmeaning in the Brain Diff results page.\n\nThe chord type's meaning is already explained generically above your sentence.\nYour job: add ONE sentence that grounds this specific firing in this specific\nvideo. Reference the quote, the timestamp, the creator name, or a specific\ncortical detail.\n\nFormat: 1 sentence, ≤ 22 words. Direct, specific, no hedge language.\nNo anatomical jargon. No percentages. No citations. No winner/loser framing.\n\nInputs:\n- Chord type: Learning Moment\n- Chord general meaning (already on page, do not repeat): The cortex is encoding what will be remembered. The dorsal attention network and the left ventrolateral prefrontal cortex co-activate — sustained attention plus the subsequent-memory effect (Wagner 19\n- Firing timestamp (M:SS): 0:24\n- Firing video subject: Veritasium\n- Quote at this moment: Imagine integrating along this curve...\n- Specific values that triggered the chord: (not provided)\n\nVoice exemplars (this slot's anchors):\n  - The metaphor lands because attention and memory peak together — a moment built to be remembered tomorrow.\n  - The metaphor sticks because attention and memory peak together — exactly when the subsequent-memory effect predicts retention.\n  - The cortex is committing this image to long-term storage in real time.\n\nGenerate 2 candidate sentences. Select the one with the most specific grounding.\nOutput only the selected sentence as a single string. No explanation.\n",
  "candidates": [
    "The viewer's body responds at 0:24 before deciding whether to care."
  ],
  "selected": "The viewer's body responds at 0:24 before deciding whether to care.",
  "attempts": 1,
  "validation": {
    "passed": true,
    "errors": []
  },
  "latency_ms": 45
}