{
  "schema_version": "raw_slot.v1",
  "slot": "chord_moments[1].context",
  "comparison_id": "0fefa93a76d08253",
  "run_id": "f6cc3910-35df-41c9-ba16-abdb5625248b",
  "generated_at": "2026-05-04T04:24:43.161826+00:00",
  "model": {
    "model_id": "stub-llama-3.2-3b-instruct",
    "model_revision": "stub-v0",
    "seed": 1350451291,
    "do_sample": false,
    "temperature": 0.4,
    "top_p": 0.9,
    "max_new_tokens": 80
  },
  "asset_hashes": {
    "voice_exemplars_hash": "1f0417fa2af2",
    "recipe_library_version": "1.0",
    "chord_library_version": "1.0"
  },
  "prompt_rendered": "You are writing one personalized sentence to append to a chord's general\nmeaning in the Brain Diff results page.\n\nThe chord type's meaning is already explained generically above your sentence.\nYour job: add ONE sentence that grounds this specific firing in this specific\nvideo. Reference the quote, the timestamp, the creator name, or a specific\ncortical detail.\n\nFormat: 1 sentence, ≤ 22 words. Direct, specific, no hedge language.\nNo anatomical jargon. No percentages. No citations. No winner/loser framing.\n\nInputs:\n- Chord type: Social Resonance\n- Chord general meaning (already on page, do not repeat): The right temporo-parietal junction and the medial prefrontal cortex co-activate — the cortex is modeling another mind while asking how it relates to the self. This is the cortical pattern under paras\n- Firing timestamp (M:SS): 0:22\n- Firing video subject: Vox\n- Quote at this moment: Carl Sagan wrote about this...\n- Specific values that triggered the chord: (not provided)\n\nVoice exemplars (this slot's anchors):\n  - The viewer is not just watching the speaker — the cortex is modelling them, asking how they relate.\n  - The right TPJ and mPFC fire together — the cortical pattern under parasocial bonding.\n\nGenerate 2 candidate sentences. Select the one with the most specific grounding.\nOutput only the selected sentence as a single string. No explanation.\n",
  "candidates": [
    "The viewer's body responds at 0:22 before deciding whether to care."
  ],
  "selected": "The viewer's body responds at 0:22 before deciding whether to care.",
  "attempts": 1,
  "validation": {
    "passed": true,
    "errors": []
  },
  "latency_ms": 45
}