{
  "schema_version": "raw_slot.v1",
  "slot": "chord_moments[0].meaning",
  "comparison_id": "0fefa93a76d08253",
  "run_id": "01a85ff8-9cd6-4238-aeb5-1716313310ae",
  "generated_at": "2026-05-04T05:12:12.192875+00:00",
  "model": {
    "model_id": "stub-llama-3.2-3b-instruct",
    "model_revision": "stub-v0",
    "seed": 1224014480,
    "do_sample": false,
    "temperature": 0.4,
    "top_p": 0.9,
    "max_new_tokens": 220
  },
  "asset_hashes": {
    "voice_exemplars_hash": "1f0417fa2af2",
    "recipe_library_version": "1.0",
    "chord_library_version": "1.0"
  },
  "prompt_rendered": "You are rewriting the meaning of a chord — but for THIS specific firing in\nTHIS specific video, not the generic textbook explanation.\n\nThe chord type's generic meaning is provided as reference. Your job: write a\nCONTEXTUALISED meaning that explains why this chord fired here — using the\nquote at this moment, the timestamp, the systems that crossed threshold, and\nthe video's title. The result should READ like a normal explanation of the\nchord, but be specific to this firing instead of generic.\n\nThis REPLACES the generic meaning on the page — the user only sees yours.\nSo it must (a) explain the chord type's mechanism in plain language, AND (b)\nground that explanation in this video's specific moment.\n\nFormat: 2-3 sentences, ≤ 70 words. Direct, specific, plain English. May use\nthe chord type's anatomical anchors sparingly if it helps explain (e.g.\n\"anterior insula\"), but DO NOT include percentages, r-values, citations, or\nyear stamps. No winner/loser framing. Use the video TITLE, not creator names.\n\nInputs:\n- Chord type: Story Integration\n- Generic meaning (reference only — rewrite, don't quote): Three systems coordinate: memory encoding what's happening, theory-of-mind tracking who's doing it, and the language network processing how it's being told. This is the cortical signature of the brain treating content as a story rather than a series of moments — the network state under sustained narrative comprehension.\n- Firing timestamp (M:SS): 0:28\n- Video title: Vox\n- Quote at this moment: And then a strange pattern emerged...\n- Specific cortical values that triggered the chord: (not provided)\n- The systems that crossed threshold for this chord: memory_encoding, social_thinking, language_depth\n\nVoice exemplars for this chord type (anchors):\n  - The cortex is treating the content as a story — memory, mentalising, and language working as one network.\n  - Three systems coordinate — narrative comprehension goes online and stays online.\n\nGenerate 2 candidate contextualised meanings. Select the one that most\nspecifically grounds the explanation in this firing. Output only the selected\nmeaning. No explanation, no quotes around the output.\n",
  "candidates": [
    "At 0:28 in Vox, the body reacts before the mind catches up. The systems involved cross threshold together while cognitive control stays quiet — a moment that lands in the chest before the brain has decided whether to care."
  ],
  "selected": "At 0:28 in Vox, the body reacts before the mind catches up. The systems involved cross threshold together while cognitive control stays quiet — a moment that lands in the chest before the brain has decided whether to care.",
  "attempts": 1,
  "validation": {
    "passed": true,
    "errors": []
  },
  "latency_ms": 38
}