{
  "schema_version": "raw_slot.v1",
  "slot": "chord_moments[2].meaning",
  "comparison_id": "6b4cf129dfb0bd3a",
  "run_id": "ccd04925-4674-4190-a51a-61598cf52e2f",
  "generated_at": "2026-05-04T07:11:46.186716+00:00",
  "model": {
    "model_id": "meta-llama/Llama-3.2-3B-Instruct",
    "model_revision": "meta-llama/Llama-3.2-3B-Instruct",
    "seed": 2269121251,
    "do_sample": false,
    "temperature": 0.4,
    "top_p": 0.9,
    "max_new_tokens": 220
  },
  "asset_hashes": {
    "voice_exemplars_hash": "1f0417fa2af2",
    "recipe_library_version": "1.0",
    "chord_library_version": "1.0"
  },
  "prompt_rendered": "You are rewriting the meaning of a chord — but for THIS specific firing in\nTHIS specific video, not the generic textbook explanation.\n\nThe chord type's generic meaning is provided as reference. Your job: write a\nCONTEXTUALISED meaning that explains why this chord fired here — using the\nquote at this moment, the timestamp, the systems that crossed threshold, and\nthe video's title. The result should READ like a normal explanation of the\nchord, but be specific to this firing instead of generic.\n\nThis REPLACES the generic meaning on the page — the user only sees yours.\nSo it must (a) explain the chord type's mechanism in plain language, AND (b)\nground that explanation in this video's specific moment.\n\nFormat: 2-3 sentences, ≤ 70 words. Direct, specific, plain English. May use\nthe chord type's anatomical anchors sparingly if it helps explain (e.g.\n\"anterior insula\"), but DO NOT include percentages, r-values, citations, or\nyear stamps. No winner/loser framing. Use the video TITLE, not creator names.\n\nInputs:\n- Chord type: Visceral Hit\n- Generic meaning (reference only — rewrite, don't quote): The body reacts before the mind catches up. The anterior insula — the cortex's interoceptive hub, mapping body-state signals into felt sensation — fires high while the dorsolateral prefrontal cortex stays quiet. This pattern is the cortical signature of a moment that arrives in the chest before the brain has decided whether to care. Pre-reflective. Bypasses analysis.\n- Firing timestamp (M:SS): 0:08\n- Video title: MrBeast\n- Quote at this moment: I'll give one million dollars to the last person standing.\n- Specific cortical values that triggered the chord: (not provided)\n- The systems that crossed threshold for this chord: gut_reaction, brain_effort\n\nVoice exemplars for this chord type (anchors):\n  - The viewer's body responds to the offer before they've decided whether they care.\n  - The viewer's body responds to the threat before they've decided whether to flinch.\n  - MrBeast's hook lands in the chest before the prefrontal cortex has time to evaluate it.\n\nGenerate 2 candidate contextualised meanings. Select the one that most\nspecifically grounds the explanation in this firing. Output only the selected\nmeaning. No explanation, no quotes around the output.\n",
  "candidates": [
    "The Visceral Hit chord fired at 0:08 in \"MrBeast\" as the body reacted to the sudden, life-changing offer of one million dollars, bypassing the need for rational evaluation, and landing squarely in the chest, where the gut_reaction system crossed the threshold, triggering a primal response that pre-empted the brain's effort to analyze the situation."
  ],
  "selected": "The Visceral Hit chord fired at 0:08 in \"MrBeast\" as the body reacted to the sudden, life-changing offer of one million dollars, bypassing the need for rational evaluation, and landing squarely in the chest, where the gut_reaction system crossed the threshold, triggering a primal response that pre-empted the brain's effort to analyze the situation.",
  "attempts": 1,
  "validation": {
    "passed": true,
    "errors": []
  },
  "latency_ms": 142938
}